198,평점4,"빠른배송감사해요
그런데 제가 신발 볼이넗은데 너무 좁아서신기가 힘드네요
하지만 볼이좁은분들은 잡아주는 느낌이 너무좋아요","빠른배송감사해요
그런데 제가 신발 볼이넗은데 너무 좁아서신기가 힘드네요
하지만 볼이좁은분들은 잡아주는 느낌이 너무좋아요"
199,평점5,"세일할 때 가격대비 신발이 튼튼싼 것 같아요.
비슷한 디자인 2번째 구매 만족해요.
아주추운 겨울에는 발이 시려요.","세일할 때 가격대비 신발이 튼튼싼 것 같아요.
비슷한 디자인 2번째 구매 만족해요.
아주추운 겨울에는 발이 시려요."
200,평점5,"최고입니다 다른 색상으로 하나 더 구매하고 싶을 정도네요~
가볍고 쿠션도 좋고 편안합니다","최고입니다 다른 색상으로 하나 더 구매하고 싶을 정도네요~
가볍고 쿠션도 좋고 편안합니다"
201,평점5,와우 신발이쁘고 잘샀습니다 대박 만족! 치수는 10크게,와우 신발이쁘고 잘샀습니다 대박 만족! 치수는 10크게
202,평점5,가볍고 좋아요 싸게샀는데 정품으로 믿고 구매합니다,가볍고 좋아요 싸게샀는데 정품으로 믿고 구매합니다
203,평점5,가볍고 조깅하기 좋을거 같아요 저렴하게 잘 구매함,가볍고 조깅하기 좋을거 같아요 저렴하게 잘 구매함
204,평점5,뛸때도 발이 편하고 한몸이 된 것처럼 좋아하네요,뛸때도 발이 편하고 한몸이 된 것처럼 좋아하네요
205,평점5,빠른배송 시증보다 저렴하게 샀네요 신발이뻐요,빠른배송 시증보다 저렴하게 샀네요 신발이뻐요
206,평점5,편하고 핏도 예쁘네요 운동할때신으려고 구입,편하고 핏도 예쁘네요 운동할때신으려고 구입
207,평점5,"가볍고 편해요.
사이즈도 딱 좋고 만족 합니다!!","가볍고 편해요.
사이즈도 딱 좋고 만족 합니다!!"
208,평점5,자주 이용하고 있습니다~배송 빠르고 좋아요~^^,자주 이용하고 있습니다~배송 빠르고 좋아요~^^
209,평점5,디자인 깔끔해요~ 생각한거 보다 더 이뿌네요!,디자인 깔끔해요~ 생각한거 보다 더 이뿌네요!
210,평점5,가볍고 신고 다니기 편해서 마음에 쏙 드네요,가볍고 신고 다니기 편해서 마음에 쏙 드네요
211,평점5,"생각보다 괜찮습니다
저렴하게 잘 구입했네요","생각보다 괜찮습니다
저렴하게 잘 구입했네요"
212,평점5,"헬스 다닐때 신으려고 샀는데 저렴하게 잘 산것 같아요 ㅎㅎㅎ
가볍고 너무 좋습니다","헬스 다닐때 신으려고 샀는데 저렴하게 잘 산것 같아요 ㅎㅎㅎ
가볍고 너무 좋습니다"
213,평점5,색이 올블랙이라 출퇴근용으로 딱 좋습니다,색이 올블랙이라 출퇴근용으로 딱 좋습니다
214,평점5,저렴한가격에 좋은 품질 너무잘샀네요 굿굿,저렴한가격에 좋은 품질 너무잘샀네요 굿굿
215,평점5,레볼루션 5보다 살짝 작아요~~^^ 가성비 짱ㅎ,레볼루션 5보다 살짝 작아요~~^^ 가성비 짱ㅎ
216,평점5,이쁘내요 발바닥ㅇ아주 푹신한건아니군요,이쁘내요 발바닥ㅇ아주 푹신한건아니군요
217,평점5,디자인도 이쁘고 가볍고 가성비 최고에요.,디자인도 이쁘고 가볍고 가성비 최고에요.
218,평점5,가볍고 진짜편합니다 265신는데 이건 좀작아서 270으로 교환했습니다 교환도 다음날 바로 배송해주시고 빠른처리 넘 좋았습니다,가볍고 진짜편합니다 265신는데 이건 좀작아서 270으로 교환했습니다 교환도 다음날 바로 배송해주시고 빠른처리 넘 좋았습니다
219,평점5,사이즈 잘 맞고 좋아요. 저렴히 잘 샀어요,사이즈 잘 맞고 좋아요. 저렴히 잘 샀어요
220,평점4,색깔도 디자인모두매우만족합니다,색깔도 디자인모두매우만족합니다
221,평점5,편하고 가볍고 걸을때 발이 편해요,편하고 가볍고 걸을때 발이 편해요
222,평점5,저렴한 가격에 잘산거 같아 좋아요,저렴한 가격에 잘산거 같아 좋아요
223,평점5,세일로 저렴하게 구매해서 좋아요.,세일로 저렴하게 구매해서 좋아요.
224,평점5,올블랙이라 좋아요 가볍고 편해요,올블랙이라 좋아요 가볍고 편해요
225,평점4,무난하고 이뻐요 가벼워서 좋네요,무난하고 이뻐요 가벼워서 좋네요
226,평점4,"편하고 가격도 착합니다
잘 샀어요","편하고 가격도 착합니다
잘 샀어요"
227,평점4,"만족스럽습니다
가볍고 편하네요!","만족스럽습니다
가볍고 편하네요!"
228,평점5,좋아요 배송도 상품도. 좋습니다.,좋아요 배송도 상품도. 좋습니다.
229,평점5,편안하고 좋습니다~가성비좋아요,편안하고 좋습니다~가성비좋아요
230,평점5,신발 가격 착하고 디자인 좋아요,신발 가격 착하고 디자인 좋아요
231,평점5,맘에 들어요 사이즈도 딱 맞고요,맘에 들어요 사이즈도 딱 맞고요
232,평점5,가볍고 편해요..저렴하게 샀네요,가볍고 편해요..저렴하게 샀네요
233,평점5,가볍고 사이즈도 맞네요~ 좋아요,가볍고 사이즈도 맞네요~ 좋아요
234,평점4,가볍고 편하네요 막신기 좋아요,가볍고 편하네요 막신기 좋아요
235,평점5,싸게 잘샀네요 너무 만족합니다,싸게 잘샀네요 너무 만족합니다
236,평점5,가성비 최고죠. 가볍고 좋아요.,가성비 최고죠. 가볍고 좋아요.
237,평점5,할인받아서 저렴하게 잘샀어요~,할인받아서 저렴하게 잘샀어요~
238,평점5,빠르고 디자인도 이쁘고 좋아요,빠르고 디자인도 이쁘고 좋아요
239,평점5,괜찮은것 같아요~~ 맘에 드네요,괜찮은것 같아요~~ 맘에 드네요
240,평점5,발쿠션도편하고 만족해요,발쿠션도편하고 만족해요
241,평점5,"정사이즈에요 발에 딱 맞네요
나이키 명성에 답게 보급라인도 편안하고 좋네요
배송도 하루만에 왔어요 상품도 정품 나이키 제품이고 좋네요","정사이즈에요 발에 딱 맞네요
나이키 명성에 답게 보급라인도 편안하고 좋네요
배송도 하루만에 왔어요 상품도 정품 나이키 제품이고 좋네요"
242,평점5,신발이가볍고만족합니다,신발이가볍고만족합니다
243,평점5,너무 좋아요 감사합니다,너무 좋아요 감사합니다
244,평점5,맘에드내요 감사합니다,맘에드내요 감사합니다
245,평점5,가격저렴하고 좋아요~~~,가격저렴하고 좋아요~~~
246,평점5,싸게잘샀네요만족해요,싸게잘샀네요만족해요
247,평점5,좋아요 감사합니다~~~~,좋아요 감사합니다~~~~
248,평점5,만족합니다 별 다섯개,만족합니다 별 다섯개
249,평점5,굿 좋아요 감사합니다,굿 좋아요 감사합니다
250,평점5,가격 대비 잘샀어요~~,가격 대비 잘샀어요~~
251,평점4,저렴하게 잘 샀어요.,저렴하게 잘 샀어요.
252,평점5,싸게 잘 샀어요...,싸게 잘 샀어요...
253,평점5,좋습니다좋습니다좋습니다,좋습니다좋습니다좋습니다
254,평점5,발이너무나 편해요 어쩜이리발이 편한지 감동입니다 신고 뛰어나갑니다ㅎㅎ,발이너무나 편해요 어쩜이리발이 편한지 감동입니다 신고 뛰어나갑니다ㅎㅎ
255,평점5,한 사이즈업 하니 딱 맞고 너무 좋아요!! 가볍고 너무 편해요!!,한 사이즈업 하니 딱 맞고 너무 좋아요!! 가볍고 너무 편해요!!
256,평점5,좋은 가격에 잘 구매했습니다. 운동용으로 구매했습니다 싸서 막 신ㄱ 좋아요 큰 기능성을 기대할 수는 없지만 잘 신겠습닏나,좋은 가격에 잘 구매했습니다. 운동용으로 구매했습니다 싸서 막 신ㄱ 좋아요 큰 기능성을 기대할 수는 없지만 잘 신겠습닏나
257,평점4,"발볼이 좁아서 신기에 불편해요.
한 사이즈 크게 샀는데 두사이즈 크게 신으면 괜찮을 것 같아요","발볼이 좁아서 신기에 불편해요.
한 사이즈 크게 샀는데 두사이즈 크게 신으면 괜찮을 것 같아요"
258,평점5,운동하기에 적당하고 가격도 적당해서 좋내요,운동하기에 적당하고 가격도 적당해서 좋내요
259,평점5,사이즈도 좋고 착화감도 좋고 마감도 깔끔해서 맘에 듭니다. 잘신을께요,사이즈도 좋고 착화감도 좋고 마감도 깔끔해서 맘에 듭니다. 잘신을께요
260,평점5,가볍고 편합니다 저렴하게 잘 구입합니다,가볍고 편합니다 저렴하게 잘 구입합니다
261,평점5,좋아요 좋아요 잘받았어요,좋아요 좋아요 잘받았어요
262,평점5,감사합니다 만족합니다,감사합니다 만족합니다
263,평점5,괜찮아요 쓸만해요 괜찮아요,괜찮아요 쓸만해요 괜찮아요
264,평점5,편하고 좋아요 좋아요,편하고 좋아요 좋아요
265,평점5,맘에들어요 맘에들어요,맘에들어요 맘에들어요
266,평점5,좋아요~~좋아요~~,좋아요~~좋아요~~
267,평점5,감사합니다 감사합니다!,감사합니다 감사합니다!
268,평점5,좋아요 좋아요 ㅎㅎㅎㅎ,좋아요 좋아요 ㅎㅎㅎㅎ
269,평점5,"사이즈가 작게 나왔다는 걸 구매 후 다른 사이트 통해 알게 되어 걱정했는데, 다행히 잘 맞아요^^아직은 신발 신을 때 입구가 뻑뻑해서 신기가 다소 힘들지만 계속 신으몀 편해지겠죠^^","사이즈가 작게 나왔다는 걸 구매 후 다른 사이트 통해 알게 되어 걱정했는데, 다행히 잘 맞아요^^아직은 신발 신을 때 입구가 뻑뻑해서 신기가 다소 힘들지만 계속 신으몀 편해지겠죠^^"
270,평점5,러닝을 좋아라해서 3개월정도밖에 못신습니다. 페가수스만 신다가 가격이 부담스러워 바꿔봤는데 디자인은 예쁘다고 할수없지만 운동용으론 충분해보입니다. 나이키포스는 265신는데 이 제품 270이 잘 맞습니다.,러닝을 좋아라해서 3개월정도밖에 못신습니다. 페가수스만 신다가 가격이 부담스러워 바꿔봤는데 디자인은 예쁘다고 할수없지만 운동용으론 충분해보입니다. 나이키포스는 265신는데 이 제품 270이 잘 맞습니다.
271,평점5,"처음에는 별기대없었어요~
가격대비 품질으뜸입니다
사이즈도 완전맞춤
배송시간도 적절하구 담에두 꼭 주문하겠습니다 포장상태 최상위
내주위에 지인들에게 광고하면서 다립니다
가격이 이게 정말맞는가 싶었어요","처음에는 별기대없었어요~
가격대비 품질으뜸입니다
사이즈도 완전맞춤
배송시간도 적절하구 담에두 꼭 주문하겠습니다 포장상태 최상위
내주위에 지인들에게 광고하면서 다립니다
가격이 이게 정말맞는가 싶었어요"
272,평점1,"박스가 구겨져 오는것까지는 이해하지만
상자여는데 신발감싸는 종이도 없고
택도 없고 어이도 없네요 진열상품 보내셧나....
사이즈 맞아서 신랑이 그냥 신긴하는데 이렇게 파는건 아닌거 같네요 배송도 느립니다","박스가 구겨져 오는것까지는 이해하지만
상자여는데 신발감싸는 종이도 없고
택도 없고 어이도 없네요 진열상품 보내셧나....
사이즈 맞아서 신랑이 그냥 신긴하는데 이렇게 파는건 아닌거 같네요 배송도 느립니다"
273,평점3,"평상시보다 5미리 큰걸로 주문해서 왔는데 그런데도 야간작은 듯 ,신다보면 늘어나겠지 생각하고 신었는데 하루신고 신발장에 쳐박힘 발가락이 너무아파 처다보기도 싫음","평상시보다 5미리 큰걸로 주문해서 왔는데 그런데도 야간작은 듯 ,신다보면 늘어나겠지 생각하고 신었는데 하루신고 신발장에 쳐박힘 발가락이 너무아파 처다보기도 싫음"
274,평점5,"신발편하고 대신 처음신을때 적응좀 필요해요
평소에 잘뛰던 저는 상관없지만 안뛰다가 뛰시는분은 뒷꿈치가 좀 까치거나할거같아요
신발자체는 좋습니다","신발편하고 대신 처음신을때 적응좀 필요해요
평소에 잘뛰던 저는 상관없지만 안뛰다가 뛰시는분은 뒷꿈치가 좀 까치거나할거같아요
신발자체는 좋습니다"
275,평점5,"문의내역엔 정사이즈로 나왔다고 하고
따로 찾아봤을땐 사람들이 사이즈가 작게 나왔다고 해서
한치수 높여서 구매했는데 그래도 발이 좀 끼네요 ㅠ
러닝이나 등산 등등 운동을 하면 발볼쪽이 쓸립니다
사이즈 말곤 좋아요..","문의내역엔 정사이즈로 나왔다고 하고
따로 찾아봤을땐 사람들이 사이즈가 작게 나왔다고 해서
한치수 높여서 구매했는데 그래도 발이 좀 끼네요 ㅠ
러닝이나 등산 등등 운동을 하면 발볼쪽이 쓸립니다
사이즈 말곤 좋아요.."
276,평점5,발볼이 매우 좁게 나와서 한사이즈 업했어요. 칼발이신분들은 그대로 주문해도 되지 않을까 생각해요. 가볍고 예쁘네요,발볼이 매우 좁게 나와서 한사이즈 업했어요. 칼발이신분들은 그대로 주문해도 되지 않을까 생각해요. 가볍고 예쁘네요
277,평점5,동생이 다이어트 후 발도 작아져서 작은 사이즈 신청했다가 작아서 다시 교환했어요. 번거로울줄 알았는데 교환도 신속했고요. 신었을때 너무 가볍다고 동생이 아주 만족하니 좋습니다.,동생이 다이어트 후 발도 작아져서 작은 사이즈 신청했다가 작아서 다시 교환했어요. 번거로울줄 알았는데 교환도 신속했고요. 신었을때 너무 가볍다고 동생이 아주 만족하니 좋습니다.
278,평점5,"남편 신발로 구입했는데...너무 속상하네요.
편안하고 엄청 예뻤는데 하루 신고 나가서 골프연습장에 잠깐 벗어 놨는데 누가 훔쳐 갔어요. 그래서 오늘 다른 나이키 한켤레 더 구입했습니다.","남편 신발로 구입했는데...너무 속상하네요.
편안하고 엄청 예뻤는데 하루 신고 나가서 골프연습장에 잠깐 벗어 놨는데 누가 훔쳐 갔어요. 그래서 오늘 다른 나이키 한켤레 더 구입했습니다."
279,평점5,"발등이 높고 발볼이 좀 있는 275 신는데 작게 나왔다는 말에 한사이즈 업했습니다
다행히 편하게 잘 맞습니다
앞으로 이 신발은 280으러 정착하면 될 것 같아요","발등이 높고 발볼이 좀 있는 275 신는데 작게 나왔다는 말에 한사이즈 업했습니다
다행히 편하게 잘 맞습니다
앞으로 이 신발은 280으러 정착하면 될 것 같아요"
280,평점5,아들이 갖고싶어해서 샀네요~ 사이즈미스로 교환했는데 빠른 처리로 잘받았네요~ 깔창이 살짝 높이가 있어서 얇은 걸로 교체해서 잘신고 있어요~,아들이 갖고싶어해서 샀네요~ 사이즈미스로 교환했는데 빠른 처리로 잘받았네요~ 깔창이 살짝 높이가 있어서 얇은 걸로 교체해서 잘신고 있어요~
281,평점5,"배송도 빠르고. 제품도 맘에 들고.

지저분해지는거 신경 덜써도 되고 좋습니다.","배송도 빠르고. 제품도 맘에 들고.

지저분해지는거 신경 덜써도 되고 좋습니다."
282,평점5,"발볼이 넓은편이라
앞코가 낀다고하는데 며칠신으면 좋아지겠죠
맘에들어합니다","발볼이 넓은편이라
앞코가 낀다고하는데 며칠신으면 좋아지겠죠
맘에들어합니다"
283,평점4,조금 작은감이있어요 ㅠ ㅠ 다른 상품보다 작게 나온거같네요 착화감은 좋아요,조금 작은감이있어요 ㅠ ㅠ 다른 상품보다 작게 나온거같네요 착화감은 좋아요
284,평점5,"엄청 빨리 배송되고 포장도 안전하고 깔끔하게 왔습니다.
신발도 가볍고 좋네요","엄청 빨리 배송되고 포장도 안전하고 깔끔하게 왔습니다.
신발도 가볍고 좋네요"
285,평점5,발볼 넓은 아들에게 딱이라 운동할때 신게 두켤레 구입했어요. 가볍고 편해요,발볼 넓은 아들에게 딱이라 운동할때 신게 두켤레 구입했어요. 가볍고 편해요
286,평점5,270 주문했다가 280으로 다시 주문합니다.반품비에 손해가 이만저만이 아니네요.신발은 괜찮은것 같아요.,270 주문했다가 280으로 다시 주문합니다.반품비에 손해가 이만저만이 아니네요.신발은 괜찮은것 같아요.
287,평점5,초딩아들 막신는 용도로 구매했어요 발이 넘 빨리커서 ㅠ살짝 큰데 괜찮아요,초딩아들 막신는 용도로 구매했어요 발이 넘 빨리커서 ㅠ살짝 큰데 괜찮아요
288,평점5,가볍고 좋습니다 사이즈가 조금 작게 나온듯 하긴 합니다 신에 따라서 255도 신기는 하는데 260이 딱 맞네요,가볍고 좋습니다 사이즈가 조금 작게 나온듯 하긴 합니다 신에 따라서 255도 신기는 하는데 260이 딱 맞네요
289,평점5,"나이키 신발이라 발볼이 조금 타이트하긴 하지만, 착화감 자체는 좋습니다:)","나이키 신발이라 발볼이 조금 타이트하긴 하지만, 착화감 자체는 좋습니다:)"
290,평점5,운동화 요즘 조금 타이트하게 나온다고해서 270mm 주문 편하고 좋아요 ㅎㅎ,운동화 요즘 조금 타이트하게 나온다고해서 270mm 주문 편하고 좋아요 ㅎㅎ
291,평점3,상품을 받아보니까 생각보다는 별로고 선물용으로 샀는데 잘 모르겠네요.,상품을 받아보니까 생각보다는 별로고 선물용으로 샀는데 잘 모르겠네요.
292,평점5,"저렴한 가격에 감사합니다.
사이즈가 작아서 추가 교환하여 받았습니다.
한치수 무조건 크게 주문하세요.","저렴한 가격에 감사합니다.
사이즈가 작아서 추가 교환하여 받았습니다.
한치수 무조건 크게 주문하세요."
293,평점5,"중딩 아들 평소 255 신는데 260 주문하니 딱이네요
체육시간에 편하게 신으라고 사줬더니 만족해하네요","중딩 아들 평소 255 신는데 260 주문하니 딱이네요
체육시간에 편하게 신으라고 사줬더니 만족해하네요"
294,평점5,"가볍고 착화감 좋습니다~
발볼 넓으신분들은 꼭 한치수 크게 주문하세요~","가볍고 착화감 좋습니다~
발볼 넓으신분들은 꼭 한치수 크게 주문하세요~"
295,평점5,가볍고 편해요.사이즈 작게나왔다해서 한치수 크게 샀더니 딱 맞습니다.,가볍고 편해요.사이즈 작게나왔다해서 한치수 크게 샀더니 딱 맞습니다.
296,평점5,사이즈 없어서 한치수 크게 주문했는데 나쁘지 않아요 작은것보다 나은,사이즈 없어서 한치수 크게 주문했는데 나쁘지 않아요 작은것보다 나은
297,평점5,사이즈가 작아서 한치수큰걸로 교환했더니 잘 맞아요.품질은 좋슴니다,사이즈가 작아서 한치수큰걸로 교환했더니 잘 맞아요.품질은 좋슴니다
298,평점5,운동화는 좋아요. 근데 눈이 와서 못 신고 계속 신발장에 있어요.ㅠ.ㅠ 겨울에 신기엔 좀 발 시려울 거 같아요.,운동화는 좋아요. 근데 눈이 와서 못 신고 계속 신발장에 있어요.ㅠ.ㅠ 겨울에 신기엔 좀 발 시려울 거 같아요.
299,평점5,"평소에 270-275인데 발볼이 넓은 편이어서 작게
나왔다는 리뷰 보고 280으로 주문했더니 편하게 딱 맞아요!
가볍고 좋아요!","평소에 270-275인데 발볼이 넓은 편이어서 작게
나왔다는 리뷰 보고 280으로 주문했더니 편하게 딱 맞아요!
가볍고 좋아요!"
300,평점4,한사이즈 크게 주문했는데 발볼이 넓어서 조금 아프다하네요,한사이즈 크게 주문했는데 발볼이 넓어서 조금 아프다하네요
301,평점5,"바닥이 좀 싼티가 나는듯한데
그래도 모양이 대체로 괜춘해요","바닥이 좀 싼티가 나는듯한데
그래도 모양이 대체로 괜춘해요"
302,평점5,가격은 엄청 저렴하게 샀는데 푹신하지 않아서 안신어요ㅠㅜ,가격은 엄청 저렴하게 샀는데 푹신하지 않아서 안신어요ㅠㅜ
303,평점5,"제것 하나 사고
아들것도 샀는데, 가볍고 신고나면 좋은데
신을적에 볼이 좁게 나오다보니, 신기 편하진않네요
하지만 신고나면 세상 가볍습니다.","제것 하나 사고
아들것도 샀는데, 가볍고 신고나면 좋은데
신을적에 볼이 좁게 나오다보니, 신기 편하진않네요
하지만 신고나면 세상 가볍습니다."
304,평점5,한치수 크게 주문 하시면 될 것 같아요 . 신발은 정말 이뻐요,한치수 크게 주문 하시면 될 것 같아요 . 신발은 정말 이뻐요
305,평점5,"동네에서 운동할 때 편하게 신는다고 주문했는데
만족합니다","동네에서 운동할 때 편하게 신는다고 주문했는데
만족합니다"
306,평점4,펀하게 신으실 수 있도록 부모님 사드렸는데 만족 하십니다.,펀하게 신으실 수 있도록 부모님 사드렸는데 만족 하십니다.
307,평점5,한사이즈 크게사서 발볼이 좀 넓은 편인데 편하고 좋습니다,한사이즈 크게사서 발볼이 좀 넓은 편인데 편하고 좋습니다
308,평점4,축구를좋아하는 아들 신발이자주 망가져요편하고 가볍대요,축구를좋아하는 아들 신발이자주 망가져요편하고 가볍대요
309,평점5,아이가 맘에 들어합니다~~ 가볍고 발이 편하다고 하네요~~^^,아이가 맘에 들어합니다~~ 가볍고 발이 편하다고 하네요~~^^
310,평점5,선물을 줬더니 좋아해요...신체 사이즈 정보는 달라요...;;;;,선물을 줬더니 좋아해요...신체 사이즈 정보는 달라요...;;;;
311,평점4,"나이키 280늘 신는 사람인데
약간 빡빡해요
디자인은 이뻐요","나이키 280늘 신는 사람인데
약간 빡빡해요
디자인은 이뻐요"
312,평점5,"도착해서 운동하면서 바로 착용했는데
편하고 아주 좋아요","도착해서 운동하면서 바로 착용했는데
편하고 아주 좋아요"
313,평점4,정싸이즈보단 조금 작은듯...외관도 깨끗하고 발도 편해요,정싸이즈보단 조금 작은듯...외관도 깨끗하고 발도 편해요
314,평점5,"정사이즈라 발이 편하고
검정이라 때도 잘 안타고
좋습니다","정사이즈라 발이 편하고
검정이라 때도 잘 안타고
좋습니다"
315,평점5,빠른배송 잘받았습니다~~디자인 이쁘고 편한운동화에요~~,빠른배송 잘받았습니다~~디자인 이쁘고 편한운동화에요~~
316,평점5,발볼이 넓은데 신기가 편할거 같아요~ 금액도 착하구요~^,발볼이 넓은데 신기가 편할거 같아요~ 금액도 착하구요~^
317,평점5,"빠른배송 잘받았습니다.
한.두치수 업하는걸 추천드려요","빠른배송 잘받았습니다.
한.두치수 업하는걸 추천드려요"
318,평점4,쿠션감은 보통이고 발볼이 좁은편인데도 넉넉하지않아요,쿠션감은 보통이고 발볼이 좁은편인데도 넉넉하지않아요
319,평점5,저는 학회에 참석해서 검정색으로 샀는데 괜찮았습니다.,저는 학회에 참석해서 검정색으로 샀는데 괜찮았습니다.
320,평점5,"발볼넓은데 잘맞구요
슬림해보이구
가벼워서 좋아요","발볼넓은데 잘맞구요
슬림해보이구
가벼워서 좋아요"
321,평점5,"생각보다 사이즈는 작게 나온 느낌
착용감은 편해요","생각보다 사이즈는 작게 나온 느낌
착용감은 편해요"
322,평점5,"선물용으로 구매했늠데
편하게 신기 좋다네요 ㅎㅎ","선물용으로 구매했늠데
편하게 신기 좋다네요 ㅎㅎ"
323,평점5,"배송도 빠르고.이중포장에 안전하게 잘 도착했슴니다.
나이키정품을 싼값에 잘 구매했습니다
만족합니다~","배송도 빠르고.이중포장에 안전하게 잘 도착했슴니다.
나이키정품을 싼값에 잘 구매했습니다
만족합니다~"
324,평점5,"제품 굿
배송도 빠르립니다
다만 정사이즈보다 한칫수 크게 구매하는것을 추천합니다.","제품 굿
배송도 빠르립니다
다만 정사이즈보다 한칫수 크게 구매하는것을 추천합니다."
325,평점5,역시 좋아요 나이키는 언제나 좋은 선택 가벼워요,역시 좋아요 나이키는 언제나 좋은 선택 가벼워요
326,평점5,"신발 무지 가볍고 편해요
소재가 신축성도 좋아요","신발 무지 가볍고 편해요
소재가 신축성도 좋아요"
327,평점5,운동할때 신을려고 주문했는데 가볍고 좋습니다.,운동할때 신을려고 주문했는데 가볍고 좋습니다.
328,평점5,가격대비 훌륭하고 너무 가벼워 헬스로 짱입니당,가격대비 훌륭하고 너무 가벼워 헬스로 짱입니당
329,평점5,"적당한 포장에 빠른 배송
상품은 가볍고 편합니다.","적당한 포장에 빠른 배송
상품은 가볍고 편합니다."
330,평점5,몇일전 나이키 매장에서 운동화 샀는데 너무 편해서 아들 보여줬더니 맘에 들어하기에 11번가에서 아들 운동화도 구매했습니다. 매장보다 18000원 저렴하네요.,몇일전 나이키 매장에서 운동화 샀는데 너무 편해서 아들 보여줬더니 맘에 들어하기에 11번가에서 아들 운동화도 구매했습니다. 매장보다 18000원 저렴하네요.
