331,평점5,"나이키.. 품질은 훌륭합니다.
사이즈는 좀 딱 끼는 느낌입니다..
참고하셔서 주문하세요.","나이키.. 품질은 훌륭합니다.
사이즈는 좀 딱 끼는 느낌입니다..
참고하셔서 주문하세요."
332,평점5,발볼이넓은편인데 이건 넉넉하니 편하고 좋네요,발볼이넓은편인데 이건 넉넉하니 편하고 좋네요
333,평점4,"신발이 편해요.
헬스장에서 신을려고 구입했어요","신발이 편해요.
헬스장에서 신을려고 구입했어요"
334,평점5,"빠른 배송과 착한 가격.
선물했는데 너무 좋아함","빠른 배송과 착한 가격.
선물했는데 너무 좋아함"
335,평점5,한칫수 크게 주문했더니 잘 맞고 신발도 이뻐요,한칫수 크게 주문했더니 잘 맞고 신발도 이뻐요
336,평점4,볼이 넓은 편이어서 착용감이 조금 불편했어요,볼이 넓은 편이어서 착용감이 조금 불편했어요
337,평점5,가볍고 좋아요. 끈주위가 고정?되어있는식이여서 끈을 풀어도 볼이 넓어지진않아요,가볍고 좋아요. 끈주위가 고정?되어있는식이여서 끈을 풀어도 볼이 넓어지진않아요
338,평점5,누가 신은 흔적이 있네요 기분 안좋네요 반품된거면 밑바닥이라도 닦아서 보내시지..,누가 신은 흔적이 있네요 기분 안좋네요 반품된거면 밑바닥이라도 닦아서 보내시지..
339,평점5,발볼이 좁은 듯 하지만 편하게 신을 수 있어요.,발볼이 좁은 듯 하지만 편하게 신을 수 있어요.
340,평점5,저렴한 가격에 나이키 슈즈 잘 신고 있어요,저렴한 가격에 나이키 슈즈 잘 신고 있어요
341,평점5,선물용으로 샀는데 저렴하게 잘 샀습니다,선물용으로 샀는데 저렴하게 잘 샀습니다
342,평점5,가볍고 디자인이 멋있어 매일 신고 다녀요,가볍고 디자인이 멋있어 매일 신고 다녀요
343,평점5,가볍고 디자인이 이뻐서 마음에 듭니다ㆍ,가볍고 디자인이 이뻐서 마음에 듭니다ㆍ
344,평점5,선물했는데 가볍고편하다고 좋아하셨어요,선물했는데 가볍고편하다고 좋아하셨어요
345,평점5,"화면에 보는것과 같고, 편해서 너무좋네요","화면에 보는것과 같고, 편해서 너무좋네요"
346,평점4,"쿠션감이좀떨어지지만.괜찮데요,남편이~~","쿠션감이좀떨어지지만.괜찮데요,남편이~~"
347,평점5,배송도 빠르고 자주이용하고 있습니다~^^,배송도 빠르고 자주이용하고 있습니다~^^
348,평점5,가볍고 탄력이 좋아요 너무나도 편해요.,가볍고 탄력이 좋아요 너무나도 편해요.
349,평점5,조카한테 선물해줬는데..좋아하네요~~~~^^,조카한테 선물해줬는데..좋아하네요~~~~^^
350,평점5,볼이 좀 좁게 나온것빼곤 편하고 이뻐요,볼이 좀 좁게 나온것빼곤 편하고 이뻐요
351,평점5,"신으니까 너무 예쁘네요
편하다고 해요^^","신으니까 너무 예쁘네요
편하다고 해요^^"
352,평점5,"아들 사줬네요~~~
잘맞고 가볍고 좋아요~~","아들 사줬네요~~~
잘맞고 가볍고 좋아요~~"
353,평점3,발볼이 많이 작아서 조금은 불편합니다.,발볼이 많이 작아서 조금은 불편합니다.
354,평점4,"가볍고 편안함
런닝용으로 구입. 만족함","가볍고 편안함
런닝용으로 구입. 만족함"
355,평점5,남자아이 짧게 막신기 괜찮은것 같아요.,남자아이 짧게 막신기 괜찮은것 같아요.
356,평점5,신발 가볍고 발도 편한 중저가용입니다,신발 가볍고 발도 편한 중저가용입니다
357,평점5,남편이 마음에 들어해요 배송도 빨라요,남편이 마음에 들어해요 배송도 빨라요
358,평점5,배송 빠르고 신어보니 가볍고 좋습니다,배송 빠르고 신어보니 가볍고 좋습니다
359,평점5,저렴하게 잘 구입해서 잘 사용중입니다,저렴하게 잘 구입해서 잘 사용중입니다
360,평점5,"가성비 짱이예요.
하나더 구입했어요.","가성비 짱이예요.
하나더 구입했어요."
361,평점5,포장도 꼼꼼 제품질도 좋아보이네요,포장도 꼼꼼 제품질도 좋아보이네요
362,평점5,이쁘네요 근데 사이즈가 좀작은듯요,이쁘네요 근데 사이즈가 좀작은듯요
363,평점5,운동할때 편하게 신을수잇어 좋아요,운동할때 편하게 신을수잇어 좋아요
364,평점5,동생선물 이였는데 아주 좋아하네요,동생선물 이였는데 아주 좋아하네요
365,평점5,사이즈도 잘 맞고 착화감이 좋네요.,사이즈도 잘 맞고 착화감이 좋네요.
366,평점5,"발이 그리편하진않아요

발바닥 아픔","발이 그리편하진않아요

발바닥 아픔"
367,평점5,배송도 빠르고 아주 마음에 듭니다.,배송도 빠르고 아주 마음에 듭니다.
368,평점4,잘신고있읍니다.착용감도조으네요.,잘신고있읍니다.착용감도조으네요.
369,평점4,저렴한 가격에 잘 구매한듯 합니다,저렴한 가격에 잘 구매한듯 합니다
370,평점4,가볍고 좋습니다! 배송도 빨랐어요!,가볍고 좋습니다! 배송도 빨랐어요!
371,평점5,편하고 좋아요 저렴하거 잘삿어요,편하고 좋아요 저렴하거 잘삿어요
372,평점4,"가벼워서 걷거나 조강할 때
좋아요","가벼워서 걷거나 조강할 때
좋아요"
373,평점5,아버지가 무지 맘에 들어하시네요~,아버지가 무지 맘에 들어하시네요~
374,평점3,좀 작은거같아요 발가락이 아파요,좀 작은거같아요 발가락이 아파요
375,평점5,좋은제품 감사합니다 잘신을께요~~,좋은제품 감사합니다 잘신을께요~~
376,평점4,깔끔하고 가격대비 우수합니다 ~굿,깔끔하고 가격대비 우수합니다 ~굿
377,평점5,편하고 가벼워서 운동할 때 편해요,편하고 가벼워서 운동할 때 편해요
378,평점4,다 좋은데 볼이 생각보다 좁았어요,다 좋은데 볼이 생각보다 좁았어요
379,평점5,좋은제품 저렴하게 잘 구매했어요,좋은제품 저렴하게 잘 구매했어요
380,평점5,가볍고 좋으네요. 배송도 빠르고,가볍고 좋으네요. 배송도 빠르고
381,평점5,배송도 빠르고 디자인도 좋네요.,배송도 빠르고 디자인도 좋네요.
382,평점3,신발이 너무 가볍고 편안합니다.,신발이 너무 가볍고 편안합니다.
383,평점5,"새로운신발로이탈해모았습니다
이이탈이만족해서또다른세계로가게되어감사합니다","새로운신발로이탈해모았습니다
이이탈이만족해서또다른세계로가게되어감사합니다"
384,평점5,남편 사줬는데 매우 만족합니다,남편 사줬는데 매우 만족합니다
385,평점5,맘에들어요 배송은 좀 늦었지만,맘에들어요 배송은 좀 늦었지만
386,평점4,조깅때 신으려고 샀어요 좋아요,조깅때 신으려고 샀어요 좋아요
387,평점5,기격대비 가성비 엄청 좋습니다,기격대비 가성비 엄청 좋습니다
388,평점4,가성비가 좋고 배송이 빠릅니다,가성비가 좋고 배송이 빠릅니다
389,평점5,빠르게 잘받았어요 맘에 듭니다,빠르게 잘받았어요 맘에 듭니다
390,평점5,가격 저렴하게 잘 구입했네요~~~,가격 저렴하게 잘 구입했네요~~~
391,평점5,저렴한가격에형꺼랑같이주무요,저렴한가격에형꺼랑같이주무요
392,평점5,발볼 넓은 남편은 불편해하네요,발볼 넓은 남편은 불편해하네요
393,평점5,착화감이 좋고 가져워서 좋네요,착화감이 좋고 가져워서 좋네요
394,평점5,배송도 빠르고 품질도 좋습니다,배송도 빠르고 품질도 좋습니다
395,평점5,실내 운동용으로 신어요 좋아요,실내 운동용으로 신어요 좋아요
396,평점5,배송빠르고 제품도 만족합니다.,배송빠르고 제품도 만족합니다.
397,평점5,디자인 무난하고 발이 편합니다,디자인 무난하고 발이 편합니다
398,평점5,빠른배송과 저렴한 가격 좋아요,빠른배송과 저렴한 가격 좋아요
399,평점4,장시간 싣으면 발바닥이 아파요,장시간 싣으면 발바닥이 아파요
